{
  "versao_schema": 1,
  "cursos": [],
  "disciplina": "",
  "nivel": "",
  "idioma": "pt-BR",
  "ultima_aula": "",
  "partes_para_tratar": 0,
  "documentos_vem_de": [],
  "grupos": [],
  "partes_por_tipo": [],
  "tipos_junto": [],
  "fora": [],
  "marcas": [],
  "onde_se_ensina": {},
  "documentos": []
}
